{
  "$schema": "https://json-schema.org/draft/2020-12/schema",
  "title": "Agent Manager Workflow",
  "type": "object",
  "required": ["id", "name", "steps"],
  "properties": {
    "id": { "type": "string", "pattern": "^[a-z0-9-]+$" },
    "name": { "type": "string", "minLength": 1 },
    "description": { "type": "string" },
    "steps": {
      "type": "array",
      "minItems": 1,
      "items": {
        "type": "object",
        "required": ["id", "agent", "output", "requires"],
        "properties": {
          "id": { "type": "string", "pattern": "^[a-z0-9-]+$" },
          "agent": { "type": "string", "pattern": "^[a-z0-9-]+$" },
          "output": { "type": "string", "minLength": 1 },
          "requires": { "type": "array", "items": { "type": "string" } }
        },
        "additionalProperties": false
      }
    }
  },
  "additionalProperties": false
}

